{"$schema":"https://json-schema.org/draft/2020-12/schema","$id":"https://eliasworks.dev/blueprint/0.5.5-dev/generic-compliance-report.schema.json","title":"Blueprint 0.5.5-dev Generic Compliance Report","type":"object","required":["schema_version","consumer","evaluation","overall_status","summary","results"],"properties":{"schema_version":{"const":"0.5.5-dev"},"consumer":{"type":"object","required":["id","repository"],"properties":{"id":{"type":"string","minLength":1},"repository":{"type":"string","pattern":"^[^/]+/[^/]+$"},"snapshot":{"type":"string","pattern":"^[a-f0-9]{40}$"}},"additionalProperties":false},"evaluation":{"type":"object","required":["blueprint_version","adopted_version","workflow_mode","api_authority_mode","scope_mode"],"properties":{"blueprint_version":{"const":"0.5.5-dev"},"adopted_version":{"type":"string","minLength":1},"workflow_mode":{"enum":["greenfield","brownfield"]},"api_authority_mode":{"enum":["api_backed","api_optional"]},"scope_mode":{"enum":["full","selected"]}},"additionalProperties":false},"overall_status":{"enum":["PASS","FAIL","BLOCKED"]},"summary":{"type":"object","required":["PASS","FAIL","N/A","BLOCKED","TOTAL"],"properties":{"PASS":{"type":"integer","minimum":0},"FAIL":{"type":"integer","minimum":0},"N/A":{"type":"integer","minimum":0},"BLOCKED":{"type":"integer","minimum":0},"TOTAL":{"type":"integer","minimum":0}},"additionalProperties":false},"results":{"type":"array","items":{"type":"object","required":["check_id","status","reason_code","rationale","evidence_refs"],"properties":{"check_id":{"type":"string","minLength":1},"status":{"enum":["PASS","FAIL","N/A","BLOCKED"]},"reason_code":{"enum":["PASS","CONTRACT_VIOLATION","MISSING_EVIDENCE","STALE_EVIDENCE","VERSION_MISMATCH","PREREQUISITE_BLOCKED","NOT_APPLICABLE"]},"rationale":{"type":"string","minLength":1},"evidence_refs":{"type":"array","uniqueItems":true,"items":{"type":"string","minLength":1}},"declared_status":{"enum":["PASS","FAIL","N/A","BLOCKED"]}},"additionalProperties":false}}},"additionalProperties":false}
